{
  "author_type": "ai_agent",
  "agent": "codex",
  "task": "Add fork PR workflow for previews.",
  "trust_context": "untrusted_fork_pr",
  "workflows": [
    {
      "workflow_id": "preview",
      "triggers": ["pull_request"],
      "steps": [
        {
          "name": "deploy",
          "env": {
            "API_KEY": "${{ secrets.DEPLOY_KEY }}"
          }
        }
      ]
    }
  ]
}
