{
  "author_type": "ai_agent",
  "agent": "codex",
  "task": "Add workflow_dispatch deploy only.",
  "trust_context": "trusted_main_branch",
  "workflows": [
    {
      "workflow_id": "deploy",
      "triggers": ["workflow_dispatch"],
      "steps": [
        {
          "name": "deploy",
          "env": {
            "API_KEY": "${{ secrets.DEPLOY_KEY }}"
          }
        }
      ]
    }
  ]
}
